{
  "meta": {
    "version": "1.0",
    "screenName": "GameOverScreen",
    "snapshotRef": "1772643683668_image.png"
  },
  "tokens": {
    "colors": {
      "primary": "#008290",
      "onPrimary": "#FFFFFF",
      "background": "#008290",
      "surface": "#546F78",
      "textPrimary": "#212121",
      "textSecondary": "#546F78",
      "divider": "#546F78",
      "accent": "#008290",
      "sliderActive": "#008290",
      "sliderInactive": "#546F78",
      "sliderThumb": "#FFFFFF",
      "border": "#546F78",
      "cta": "#008290",
      "success": "#00A86B",
      "warning": "#FFB300",
      "info": "#0288D1",
      "headerBackgroundDark": "#006070",
      "buttonBackground": "#546F78",
      "iconWhite": "#FFFFFF"
    },
    "typography": {
      "fontFamilies": ["sans-serif", "unknown"],
      "fontSizes": { "xs": 10, "sm": 12, "md": 14, "lg": 18, "xl": 22 },
      "fontWeights": { "regular": 400, "medium": 500, "bold": 700 },
      "lineHeights": { "sm": 16, "md": 20, "lg": 28 }
    },
    "spacing": { "xxs": 2, "xs": 4, "sm": 8, "md": 16, "lg": 24, "xl": 44 },
    "radius": { "sm": 4, "md": 8, "lg": 12, "xl": 24 },
    "shadow": { "sm": "0 1px 2px rgba(0,0,0,0.1)", "md": "0 2px 4px rgba(0,0,0,0.15)", "lg": "0 4px 8px rgba(0,0,0,0.2)" }
  },
  "screen": {
    "size": { "width": 744, "height": 1506 },
    "layout": { "orientation": "portrait", "scrollable": false }
  },
  "components": [
    {
      "id": "container-1",
      "type": "Container",
      "bbox": [0, 0, 744, 1506],
      "sourceRect": [0, 0, 744, 1506],
      "style": {
        "backgroundColor": "#008290"
      },
      "layout": {
        "type": "flex",
        "direction": "column",
        "gap": "xl",
        "align": "center",
        "justify": "center"
      },
      "group": {
        "alignment": "center",
        "distribution": "center"
      },
      "children": [
        {
          "id": "text-1",
          "type": "Text",
          "bbox": [302, 448, 440, 504],
          "sourceRect": [302, 448, 440, 504],
          "text": "FINI",
          "style": {
            "color": "#212121",
            "fontSize": 48,
            "fontWeight": "bold",
            "typographyRef": "custom",
            "transform": "uppercase"
          },
          "placement": "center",
          "widthMode": "intrinsic"
        },
        {
          "id": "container-2",
          "type": "Container",
          "bbox": [227, 958, 516, 1075],
          "sourceRect": [227, 958, 516, 1075],
          "layout": {
            "type": "flex",
            "direction": "row",
            "gap": "xl",
            "align": "center",
            "justify": "center"
          },
          "group": {
            "alignment": "center",
            "distribution": "center"
          },
          "children": [
            {
              "id": "iconbutton-1",
              "type": "IconButton",
              "variant": "secondary",
              "bbox": [227, 958, 349, 1074],
              "sourceRect": [227, 958, 349, 1074],
              "iconName": "material.stop",
              "a11y": { "ariaLabel": "Arrêter" },
              "placement": "center",
              "widthMode": "intrinsic",
              "style": {
                "backgroundColor": "#546F78",
                "color": "#FFFFFF",
                "radius": "sm",
                "paddingX": 32,
                "paddingY": 32
              },
              "children": [
                {
                  "id": "icon-1",
                  "type": "Icon",
                  "bbox": [266, 994, 311, 1039],
                  "sourceRect": [266, 994, 311, 1039],
                  "iconName": "material.stop",
                  "style": {
                    "color": "#FFFFFF",
                    "fontSize": 46
                  }
                }
              ]
            },
            {
              "id": "iconbutton-2",
              "type": "IconButton",
              "variant": "secondary",
              "bbox": [394, 958, 516, 1075],
              "sourceRect": [394, 958, 516, 1075],
              "iconName": "material.replay",
              "a11y": { "ariaLabel": "Recommencer" },
              "placement": "center",
              "widthMode": "intrinsic",
              "style": {
                "backgroundColor": "#546F78",
                "color": "#FFFFFF",
                "radius": "sm",
                "paddingX": 32,
                "paddingY": 32
              },
              "children": [
                {
                  "id": "icon-2",
                  "type": "Icon",
                  "bbox": [425, 977, 485, 1050],
                  "sourceRect": [425, 977, 485, 1050],
                  "iconName": "material.replay",
                  "style": {
                    "color": "#FFFFFF",
                    "fontSize": 61
                  }
                }
              ]
            }
          ]
        }
      ]
    }
  ],
  "qa": {
    "inventory": [
      { "idx": 1, "roughType": "Container", "roughText": "" },
      { "idx": 2, "roughType": "Text", "roughText": "FINI" },
      { "idx": 3, "roughType": "Container", "roughText": "" },
      { "idx": 4, "roughType": "IconButton", "roughText": "" },
      { "idx": 5, "roughType": "Icon", "roughText": "" },
      { "idx": 6, "roughType": "IconButton", "roughText": "" },
      { "idx": 7, "roughType": "Icon", "roughText": "" }
    ],
    "countsByType": {
      "Text": 1,
      "Button": 0,
      "Icon": 2,
      "IconButton": 2,
      "Slider": 0,
      "Container": 2,
      "Card": 0,
      "Placeholder": 0
    },
    "textCoverage": {
      "found": ["FINI"],
      "missing": []
    },
    "colorsUsed": [
      { "hex": "#008290", "token": "background" },
      { "hex": "#212121", "token": "textPrimary" },
      { "hex": "#546F78", "token": "buttonBackground" },
      { "hex": "#FFFFFF", "token": "iconWhite" }
    ],
    "missingAtoms": [],
    "coverageRatio": 1.0,
    "checklist": [
      "every visual element in snapshot has a component with bbox",
      "all texts copied verbatim",
      "colors extracted as hex",
      "interactive elements have a11y.ariaLabel",
      "no invented components",
      "units are px integers",
      "all groups represented as Container/Card with styles",
      "all groups include explicit layout"
    ],
    "semanticChecklist": [
      "group alignment encoded when visually centered",
      "non-fullwidth actions have placement and widthMode",
      "icon+label actions encoded as composed buttons (leadingIcon+text)",
      "uppercase labels use style.transform",
      "variants map to semantic color tokens (no stray hex)",
      "layout.justify coherent with group.distribution and children bbox positions",
      "fontSize coherent with typographyRef (custom if no token matches)",
      "justify/distribution use controlled vocabulary (spaceBetween, spaceAround — not between, around)"
    ],
    "assumptions": [
      {
        "item": "FINI fontSize",
        "detail": "Cap height measured at 57px. Estimated fontSize ~48px based on typical bold sans-serif cap-height-to-em ratio (~0.72-0.80). Used typographyRef:custom since no token matches.",
        "confidence": 0.75
      },
      {
        "item": "Button background color",
        "detail": "Buttons appear as semi-transparent overlay on teal background. Measured composite color is #546F78. May be a translucent gray (~rgba(128,128,128,0.4)) over #008290.",
        "confidence": 0.8
      },
      {
        "item": "Icon identification",
        "detail": "Left button icon identified as material.stop (square shape). Right button icon identified as material.replay (circular arrow). Based on visual shape matching.",
        "confidence": 0.85
      },
      {
        "item": "FINI text color",
        "detail": "Most frequent dark pixel color in text area is #212121, with slight variations due to anti-aliasing on the teal background.",
        "confidence": 0.85
      },
      {
        "item": "Button radius",
        "detail": "Buttons appear to have slight rounding at corners. Assigned radius:sm (4px). Hard to distinguish from sharp corners at this resolution.",
        "confidence": 0.65
      },
      {
        "item": "Layout justify for root container",
        "detail": "Text FINI is at ~30% vertical, buttons at ~65% vertical. This is not perfectly centered. However, the visual intent appears to be centered layout with elements grouped toward the vertical middle. Used justify:center as the closest match.",
        "confidence": 0.7
      },
      {
        "item": "Gap between buttons",
        "detail": "Measured 44px gap between left button right edge (349) and right button left edge (394). Mapped to spacing token xl (44).",
        "confidence": 0.9
      },
      {
        "item": "Font family",
        "detail": "Cannot determine exact font family from pixel data. Listed as sans-serif/unknown.",
        "confidence": 0.6
      }
    ],
    "openQuestions": [
      "Is the button background a solid color (#546F78) or a semi-transparent overlay on the teal background?",
      "Exact font family used for FINI text."
    ],
    "confidenceGlobal": 0.78
  }
}